<?xml version="1.0" encoding="UTF-8"?><mibo xmlns="http://www1.in.tum.de/mibo" xmlns:gaze="http://www1.in.tum.de/mibo/gaze" xmlns:voice="http://www1.in.tum.de/mibo/voice" xmlns:xsi="http://www.w3.org/2001/XMLSchema-instance" xsi:schemaLocation="http://www1.in.tum.de/mibo MIBO_Scheme.xsd">
    <definition id="d1" name="Button Control">
        <scope>
            <item group="Louvers"/>
            <item group="Blinds"/>
        </scope>
        <select>
            <gaze:lookAt/>
        </select>
        <control>
            <set>
                <voice:setLevel/>
            </set>
        </control>
    </definition>
</mibo>
